atlasId,atlasName,cohortId,name
2037,ACE inhibitors in Young Adults,2037,ACE_inhibitors_in_Young_Adults
2017,ARBs in Young Adults,2017,ARBs_in_Young_Adults
1820,Schizophrenia,1820,Schizophrenia
1897,Schizophrenia with ER visit,1897,Schizophrenia_with_ER_visit
1921,Thiazide in Young Adults,1921,Thiazide_in_Young_Adults
1841,ACE inhibitors in Older Adults,1841,ACE_inhibitors_in_Older_Adults
2036,ARBs in Older Adults,2036,ARBs_in_Older_Adults
2035,Thiazide in Older Adults,2035,Thiazide_in_Older_Adults
